{
  "$schema" : "https://jscene3d.org/schemas/entity-definition-1.json",
  "assetId" : "9c88cdb1-723a-4fd2-b7a5-b403b23b676d",
  "assetType" : "entity-definition",
  "formatVersion" : 1,
  "name" : "Beacon",
  "contract" : {
    "parameters" : [ {
      "id" : "label",
      "valueKind" : "text",
      "required" : false,
      "target" : {
        "entityId" : "616e9bb7-ad60-4b78-96f7-f079f4c8c777",
        "componentId" : "14b0558a-1f72-4773-a03c-af7001323f92",
        "propertyId" : "label"
      }
    } ],
    "signals" : [ ],
    "actions" : [ ],
    "capabilities" : [ ],
    "attachments" : [ ],
    "resourceBindings" : [ ]
  },
  "connections" : [ ],
  "root" : {
    "entryType" : "local",
    "entityId" : "616e9bb7-ad60-4b78-96f7-f079f4c8c777",
    "name" : "Beacon",
    "enabled" : true,
    "components" : [ {
      "componentId" : "14b0558a-1f72-4773-a03c-af7001323f92",
      "type" : "io.github.glynch.jscene3d.world-example/label",
      "typeVersion" : 1,
      "properties" : {
        "label" : "Beacon"
      }
    } ],
    "children" : [ ]
  }
}
